{
  "$schema": "https://json-schema.org/draft/2020-12/schema",
  "$id": "https://assert-lab.github.io/cocomut/schemas/extraction-manifest-v0.5.0.schema.json",
  "title": "CoCoMUT Extraction Manifest",
  "type": "object",
  "additionalProperties": false,
  "required": [
    "schema_version",
    "generated_at",
    "tool",
    "tool_version",
    "tool_git",
    "request_hash",
    "selection",
    "javadoc_inheritance",
    "project",
    "build",
    "artifacts",
    "hashes",
    "execution"
  ],
  "properties": {
    "schema_version": { "const": "0.5.0" },
    "generated_at": { "type": "string", "format": "date-time" },
    "tool": { "const": "CoCoMUT" },
    "tool_version": { "type": "string" },
    "tool_git": { "$ref": "#/$defs/gitInfo" },
    "request_hash": { "type": "string", "pattern": "^[0-9a-f]{64}$" },
    "jsonl_file": { "type": ["string", "null"] },
    "selection": { "type": "object" },
    "javadoc_inheritance": {
      "type": "object",
      "required": ["policy_id", "specification_version", "implementation_version", "defaulted", "granularity", "mode"],
      "properties": {
        "policy_id": {"const": "jdk25-standard-doclet"},
        "specification_version": {"const": "25"},
        "implementation_version": {"type": "string", "minLength": 1},
        "defaulted": {"type": "boolean"},
        "granularity": {"const": "item_level"},
        "mode": {"const": "effective_and_candidates"}
      },
      "additionalProperties": false
    },
    "execution": {
      "type": "object",
      "properties": {
        "phase_3_initialization": { "$ref": "#/$defs/callGraphInitializationDiagnostic" },
        "phase_3_max_heap_bytes": { "type": "integer", "minimum": 1 },
        "phase_3_exception_class": { "type": "string" },
        "phase_3_exception_message": { "type": ["string", "null"] }
      }
    },
    "project": {
      "type": "object",
      "additionalProperties": false,
      "required": ["name", "path", "build_system", "java_version", "git"],
      "properties": {
        "name": { "type": "string" },
        "path": { "type": "string" },
        "build_system": { "type": "string" },
        "java_version": { "type": "string" },
        "git": {
          "type": "object",
          "additionalProperties": false,
          "required": [
            "available",
            "root",
            "relative_project_path",
            "remote_url",
            "commit",
            "dirty",
            "error"
          ],
          "properties": {
            "available": { "type": "boolean" },
            "root": { "type": "string" },
            "relative_project_path": { "type": "string" },
            "remote_url": { "type": "string" },
            "commit": { "type": "string" },
            "dirty": { "type": ["boolean", "null"] },
            "error": { "type": "string" }
          }
        }
      }
    },
    "build": {
      "type": "object",
      "additionalProperties": false,
      "required": [
        "attempted",
        "exit_code",
        "succeeded",
        "timed_out",
        "blocked",
        "attempts",
        "maven_dependency_classpath_status",
        "skipped",
        "sandboxed",
        "status",
        "policy",
        "bytecode_available",
        "bytecode_origin",
        "analysis_can_proceed",
        "gradle_model"
      ],
      "properties": {
        "attempted": { "type": "boolean" },
        "exit_code": { "type": "integer" },
        "succeeded": { "type": "boolean" },
        "timed_out": { "type": "boolean" },
        "blocked": { "type": "boolean" },
        "output_tail": { "type": "string" },
        "java_home": { "type": "string" },
        "java_version": { "type": "string" },
        "java_evidence": { "type": "string" },
        "attempts": {
          "type": "array",
          "items": {
            "type": "object",
            "required": ["action", "command", "components", "javaHome", "javaVersion", "javaEvidence", "exitCode", "timedOut", "changedEnvironment", "failureReason"],
            "properties": {
              "action": { "type": "string" },
              "command": { "type": "array", "items": { "type": "string" } },
              "components": { "type": "array", "items": { "type": "string" } },
              "javaHome": { "type": "string" },
              "javaVersion": { "type": "string" },
              "javaEvidence": { "type": "string" },
              "exitCode": { "type": "integer" },
              "timedOut": { "type": "boolean" },
              "changedEnvironment": { "type": "boolean" },
              "failureReason": { "type": "string" }
            }
          }
        },
        "maven_dependency_classpath_status": {
          "enum": ["NOT_ATTEMPTED", "SUCCESS", "PARTIAL"]
        },
        "skipped": { "type": "boolean" },
        "sandboxed": { "type": "boolean" },
        "status": { "type": "string" },
        "policy": {
          "enum": [
            "DENY_BUILD",
            "ALLOW_UNSANDBOXED_BUILD",
            "EXTERNALLY_SANDBOXED_BUILD",
            "UNKNOWN"
          ]
        },
        "bytecode_available": { "type": "boolean" },
        "bytecode_origin": { "enum": ["generated_this_run", "preexisting", "explicit", "none"] },
        "analysis_can_proceed": { "type": "boolean" },
        "gradle_model": {
          "type": "object",
          "properties": {
            "buildPlan": {
              "type": "object",
              "required": ["projects", "skippedProjects", "compilationTasks", "unavailableSourceSets"],
              "properties": {
                "projects": { "type": "object", "additionalProperties": { "type": "string" } },
                "skippedProjects": { "type": "object", "additionalProperties": { "type": "string" } },
                "compilationTasks": { "type": "array", "items": { "type": "string" } },
                "unavailableSourceSets": { "type": "array", "items": { "type": "string" } }
              }
            }
          }
        }
      }
    },
    "artifacts": {
      "type": "object",
      "additionalProperties": false,
      "required": [
        "source_roots",
        "test_source_roots",
        "main_class_outputs",
        "test_class_outputs",
        "project_jars",
        "dependency_classpath",
        "explicit_class_output_dirs",
        "explicit_test_class_output_dirs",
        "explicit_project_jars",
        "explicit_dependency_jars",
        "explicit_classpath_files",
        "explicit_source_roots",
        "explicit_test_source_roots",
        "origins",
        "module_source_sets"
      ],
      "properties": {
        "source_roots": { "$ref": "#/$defs/pathArray" },
        "test_source_roots": { "$ref": "#/$defs/pathArray" },
        "main_class_outputs": { "$ref": "#/$defs/pathArray" },
        "test_class_outputs": { "$ref": "#/$defs/pathArray" },
        "project_jars": { "$ref": "#/$defs/pathArray" },
        "dependency_classpath": { "$ref": "#/$defs/pathArray" },
        "explicit_class_output_dirs": { "$ref": "#/$defs/pathArray" },
        "explicit_test_class_output_dirs": { "$ref": "#/$defs/pathArray" },
        "explicit_project_jars": { "$ref": "#/$defs/pathArray" },
        "explicit_dependency_jars": { "$ref": "#/$defs/pathArray" },
        "explicit_classpath_files": { "$ref": "#/$defs/pathArray" },
        "explicit_source_roots": { "$ref": "#/$defs/pathArray" },
        "explicit_test_source_roots": { "$ref": "#/$defs/pathArray" },
        "origins": {
          "type": "object",
          "additionalProperties": { "type": "string" }
        },
        "module_source_sets": {
          "type": "array",
          "items": { "type": "object" }
        }
      }
    },
    "hashes": {
      "type": "object",
      "additionalProperties": false,
      "required": [
        "algorithm",
        "format",
        "main_bytecode",
        "test_bytecode",
        "combined_project_bytecode",
        "dependency_classpath",
        "dependency_classpath_content_set",
        "emitted_jsonl"
      ],
      "properties": {
        "algorithm": { "const": "sha-256" },
        "format": { "const": "cocomut-artifact-v1" },
        "main_bytecode": { "$ref": "#/$defs/hashEntry" },
        "test_bytecode": { "$ref": "#/$defs/hashEntry" },
        "combined_project_bytecode": { "$ref": "#/$defs/hashEntry" },
        "dependency_classpath": { "$ref": "#/$defs/hashEntry" },
        "dependency_classpath_content_set": { "$ref": "#/$defs/hashEntry" },
        "emitted_jsonl": { "$ref": "#/$defs/hashEntry" }
      }
    }
  },
  "$defs": {
    "callGraphInitializationDiagnostic": {
      "type": "object",
      "additionalProperties": false,
      "required": ["status", "stage"],
      "properties": {
        "status": { "enum": ["success", "no_bytecode", "failed"] },
        "stage": { "enum": ["input_locations", "java_view", "class_loading"] },
        "exception_class": { "type": "string", "minLength": 1 },
        "message": { "type": "string" },
        "classpath_entry": { "type": "string", "minLength": 1 }
      },
      "if": { "properties": { "status": { "const": "failed" } } },
      "then": { "required": ["exception_class", "message"] }
    },
    "pathArray": {
      "type": "array",
      "items": { "type": "string" }
    },
    "gitInfo": {
      "type": "object",
      "additionalProperties": false,
      "required": [
        "available",
        "root",
        "relative_project_path",
        "remote_url",
        "commit",
        "dirty",
        "error"
      ],
      "properties": {
        "available": { "type": "boolean" },
        "root": { "type": "string" },
        "relative_project_path": { "type": "string" },
        "remote_url": { "type": "string" },
        "commit": { "type": "string" },
        "dirty": { "type": ["boolean", "null"] },
        "error": { "type": "string" }
      }
    },
    "hashEntry": {
      "type": "object",
      "additionalProperties": false,
      "required": ["role", "sha256", "status", "errors"],
      "properties": {
        "role": { "type": "string" },
        "sha256": {
          "type": ["string", "null"],
          "pattern": "^[0-9a-f]{64}$"
        },
        "status": { "enum": ["ok", "empty", "missing", "error"] },
        "errors": {
          "type": "array",
          "items": { "type": "string" }
        }
      },
      "oneOf": [
        {
          "properties": {
            "status": { "const": "ok" },
            "sha256": { "type": "string", "pattern": "^[0-9a-f]{64}$" },
            "errors": { "maxItems": 0 }
          }
        },
        {
          "properties": {
            "status": { "const": "empty" },
            "sha256": { "type": "null" },
            "errors": { "maxItems": 0 }
          }
        },
        {
          "properties": {
            "status": { "const": "missing" },
            "sha256": { "type": "null" },
            "errors": { "minItems": 1 }
          }
        },
        {
          "properties": {
            "status": { "const": "error" },
            "sha256": { "type": "null" },
            "errors": { "minItems": 1 }
          }
        }
      ]
    }
  }
}
