{
  "schema_version": "0.5.0",
  "generated_at": "2026-07-13T00:00:00Z",
  "tool": "CoCoMUT",
  "tool_version": "0.1.0",
  "tool_git": {
    "available": false,
    "root": "",
    "relative_project_path": "",
    "remote_url": "",
    "commit": "",
    "dirty": null,
    "error": "sample manifest"
  },
  "request_hash": "1400aba781f16f4a9288c4ef38aa675602d99d3cd7c144e0cd050da6d89e2efc",
  "jsonl_file": "method_contexts__1400aba781f16f4a.jsonl",
  "selection": {
    "kind": "project",
    "scope": "main",
    "javadoc_inheritance": {
      "policy_id": "jdk25-standard-doclet",
      "specification_version": "25",
      "implementation_version": "1",
      "defaulted": true,
      "granularity": "item_level",
      "mode": "effective_and_candidates"
    }
  },
  "project": {
    "name": "minimal-maven-project",
    "path": "<project>",
    "build_system": "maven",
    "java_version": "17",
    "git": {
      "available": false,
      "root": "",
      "relative_project_path": "",
      "remote_url": "",
      "commit": "",
      "dirty": null,
      "error": "sample manifest"
    }
  },
  "build": {
    "attempted": false,
    "exit_code": -1,
    "succeeded": false,
    "timed_out": false,
    "blocked": false,
    "output_tail": "",
    "java_home": "",
    "java_version": "17",
    "java_evidence": "sample",
    "attempts": [],
    "maven_dependency_classpath_status": "NOT_ATTEMPTED",
    "skipped": true,
    "sandboxed": false,
    "status": "BUILD DENIED; PROJECT BYTECODE AVAILABLE",
    "policy": "DENY_BUILD",
    "bytecode_available": true,
    "bytecode_origin": "explicit",
    "analysis_can_proceed": true,
    "gradle_model": {}
  },
  "artifacts": {
    "source_roots": [
      "src/main/java"
    ],
    "test_source_roots": [],
    "main_class_outputs": [
      "target/classes"
    ],
    "test_class_outputs": [],
    "project_jars": [],
    "dependency_classpath": [],
    "explicit_class_output_dirs": [
      "target/classes"
    ],
    "explicit_test_class_output_dirs": [],
    "explicit_project_jars": [],
    "explicit_dependency_jars": [],
    "explicit_classpath_files": [],
    "explicit_source_roots": [
      "src/main/java"
    ],
    "explicit_test_source_roots": [],
    "origins": {
      "target/classes": "explicit"
    },
    "module_source_sets": []
  },
  "hashes": {
    "algorithm": "sha-256",
    "format": "cocomut-artifact-v1",
    "main_bytecode": {
      "role": "main_bytecode",
      "sha256": null,
      "status": "empty",
      "errors": []
    },
    "test_bytecode": {
      "role": "test_bytecode",
      "sha256": null,
      "status": "empty",
      "errors": []
    },
    "combined_project_bytecode": {
      "role": "combined_project_bytecode",
      "sha256": null,
      "status": "empty",
      "errors": []
    },
    "dependency_classpath": {
      "role": "dependency_classpath_ordered",
      "sha256": null,
      "status": "empty",
      "errors": []
    },
    "dependency_classpath_content_set": {
      "role": "dependency_classpath_content_set",
      "sha256": null,
      "status": "empty",
      "errors": []
    },
    "emitted_jsonl": {
      "role": "emitted_jsonl",
      "sha256": null,
      "status": "empty",
      "errors": []
    }
  },
  "execution": {
    "status": "SUCCESS",
    "failure_codes": [
      "NONE"
    ]
  },
  "javadoc_inheritance": {
    "policy_id": "jdk25-standard-doclet",
    "specification_version": "25",
    "implementation_version": "1",
    "defaulted": true,
    "granularity": "item_level",
    "mode": "effective_and_candidates"
  }
}
